{
  "smallestText": 11,
  "width": 1115,
  "height": 360,
  "scale": 1,
  "origin": [
    40,
    100
  ],
  "nodes": [
    {
      "id": "ddn.usecases.commerce::concepts.customer",
      "w": 270,
      "h": 100,
      "fields": [],
      "titleLines": [
        "Customer"
      ],
      "footer": [],
      "scale": 1,
      "headerH": 64,
      "meaningLines": [],
      "noteLines": [],
      "x": 0,
      "y": 0,
      "fieldRows": []
    },
    {
      "id": "ddn.usecases.commerce::concepts.order",
      "w": 270,
      "h": 100,
      "fields": [],
      "titleLines": [
        "Order"
      ],
      "footer": [],
      "scale": 1,
      "headerH": 64,
      "meaningLines": [],
      "noteLines": [],
      "x": 390,
      "y": 0,
      "fieldRows": []
    }
  ],
  "routes": [
    {
      "id": "ddn.usecases.commerce::concepts.r_places",
      "points": [
        [
          270,
          50
        ],
        [
          390,
          50
        ]
      ],
      "label": {
        "x": 315,
        "y": 35,
        "w": 30,
        "h": 30
      },
      "source_side": "east",
      "target_side": "west",
      "routing": "orthogonal"
    }
  ],
  "crossings": [],
  "frames": [],
  "subdiagrams": [],
  "quality": {
    "errors": [],
    "labelIssues": [],
    "objectOverlaps": [],
    "routeObjectIntersections": [],
    "sharedTracks": [],
    "labelRouteIntersections": [],
    "labelPairs": [],
    "labelNodes": []
  },
  "layout": {
    "algorithm": "grid",
    "pattern": null,
    "pinned": [],
    "autoPlace": true,
    "retentionActive": false,
    "retained": [],
    "portChanges": 0,
    "nodeMoves": 0,
    "stages": [
      {
        "stage": "initial-clear-routing",
        "crossings": 0,
        "length": 120,
        "bends": 0
      },
      {
        "stage": "connection-points",
        "trials": 0,
        "accepted": 0,
        "crossings": 0,
        "length": 120,
        "bends": 0
      },
      {
        "stage": "local-endpoint-ordering",
        "crossings": 0,
        "localCrossings": 0,
        "length": 120,
        "bends": 0,
        "trials": 0,
        "accepted": 0
      },
      {
        "stage": "unpinned-elements",
        "accepted": 0,
        "crossings": 0,
        "length": 120,
        "bends": 0
      },
      {
        "stage": "residual-short-routes-and-crossing-marks",
        "crossings": 0,
        "length": 120,
        "bends": 0
      }
    ],
    "portTrials": 0,
    "endpointOrdering": {
      "policy": "optimize",
      "trials": 0,
      "accepted": 0,
      "slotSwaps": 0,
      "sideChanges": 0,
      "budget": 32,
      "before": {
        "crossings": 0,
        "localCrossings": 0,
        "length": 120,
        "bends": 0
      },
      "after": {
        "crossings": 0,
        "localCrossings": 0,
        "length": 120,
        "bends": 0
      },
      "exhausted": false
    },
    "remainingCrossings": 0,
    "routing": "orthogonal",
    "engine": "ddn-native@0.8.0"
  },
  "drawingBounds": {
    "x": 0,
    "y": 0,
    "w": 690,
    "h": 130
  },
  "drawingArea": {
    "x": 30,
    "y": 90,
    "w": 690,
    "h": 200
  },
  "layoutState": {
    "format": "ddn-layout-state@1",
    "view": "ddn.usecases.views.linked-documentation::business_detail",
    "positions": {
      "ddn.usecases.commerce::concepts.customer": [
        0,
        0
      ],
      "ddn.usecases.commerce::concepts.order": [
        390,
        0
      ]
    }
  },
  "textMeasurement": {
    "mode": "estimated",
    "requestedFont": "sans",
    "provider": "pinned-cache"
  }
}
